post_id,comment_id,comment_body,emotion,emo_pos,emo_neg,emo_anx,emo_anger,emo_sad
1,2,"That money can’t be used on school supplies, sorry. It’s listed under improvements in the budget and no your broken projector doesn’t count for improvements that’s tech and we’re out of tech money.",0,0,0,0,0,0
1,3,"Projectors are technology? Someone needs to education.
Edit: was going to fix my typo, but I think I’ll leave it.",0,0,0,0,0,0
1,4,"Our school has over 200,000 in locker money that can only be used to repair, maintain, or replace lockers. 3000 kids * $3/semester builds up fast when lockers are pretty durable. We aren't allowed to allocate the money to anything else...",0,0,0,0,0,0
1,5,Install projectors inside lockers,0,0,0,0,0,0
1,6,Portable lockers for all students to replace their backpacks. Build a pool out of lockers. Parking lot? More like park in a giant locker.,0,0,0,0,0,0
1,7,"If you try hard enough, anything can be, or be part of, a locker lol. 
Build tiny cash lockers in each classroom for each teacher to contain equal portions of the locker fund, and use the locker fund each year to replace any lost or missing locker fund money from the year before. (Effectively giving the teachers a well deserved bonus)",0,0,0,0,0,0
1,8,"You can thank the 1 in 10,000 district employee who exploited ""loopholes"" to embezzle money for this crap.
In (well-intentioned) effort to prevent $10,000 worth of fraud, states will close loopholes causing $1,000,000 in waste.",0,0,0,0,0,0
1,9,“someone needs to education” is my new fave.,0,0,0,0,0,0
1,10,You got glue sticks??,0,0,0,0,0,0
1,11,OP only has 3 glue sticks if they count the kid who's gonna eat one of them.,0,0,0,0,0,0
1,12,Very much laced with sarcasm. Teacher to teacher: I feel you.,0,0,0,0,0,0
1,13,"Is it bad that my first thought on reading OP's post was ""that's going to be an awfully thin lunch""?",10,0,10,0,0,0
1,14,Right?!?  I’ve been asking for paper clips since September.,0,0,0,0,0,0
1,15,It wasn’t a grant? Or donated by the artist?,0,0,0,0,0,0
1,16,"You wouldn’t want the crappy ones that Title 1 gives you anyways. 
Elmer’s glue sticks (not the disappearing purple kind) last way longer than my Title 1 school ones. Plus they’re harder to disassemble. Students are less likely to throw them onto the ceiling. Learned that my first year of teaching.",0,0,0,0,0,0
1,17,"Title 1 money doesn't get me any glue sticks either. My paycheck supplies them, or we don't have them.",0,0,0,0,0,0
1,18,"Oh yeah, I totally get it. We got “lucky” one year because the teachers actually got to vote for Title 1 fund allocation for classroom supplies.",0,0,0,0,0,0
1,19,Fuck that purple glue. It's dry in nanoseconds.,0,0,0,0,0,0
1,20,Fuck that purple glue when you only have five of them and all 27 kids want the purple ones.,0,0,0,0,0,0
1,21,I feel this comment deep in my soul.,0,0,0,0,0,0
1,22,LOL. I haven’t had my coffee yet. I take it the art installation is not to be created by your students using their four glue sticks.,0,0,0,0,0,0
1,23,"That's what I thought first, haha!",16.67,16.67,0,0,0,0
1,24,"Honestly if I thought I could get them to you I'd take my extras and mail them. I probably have over 30. I was given a whole classroom worth for 8 children. Plus what was left from shutting down last year plus extra. I kept passing them out to other teachers in my school and still have more than enough for next year. 
(Florida, special education. Very lucky when it came to supplies.)
I'm sorry that your school is dumb.",0,0,0,0,0,0
1,25,Why buy glue sticks when the teachers already do? We have to stop enabling bad behavior.,6.25,0,6.25,0,0,0
1,26,"My school raised several million dollars to turn our parking lot into a playground (still haven't started construction). Also, teachers got no pay raises last year...",0,0,0,0,0,0
1,27,"PREAAAAACH. My school’s PTA has 30k in a bank, but they can’t afford to buy a class set of mini whiteboards for me :-)",4.17,4.17,0,0,0,0
1,28,"I don’t want to upset you or anything, for although we have no glue, I saw an order of about 100 mini whiteboards coming into the office the other day (we already have a few class sets from other years in our classrooms because we don’t throw them away every year but someone’s continued to buy them without consulting the teachers)",1.64,0,1.64,0,0,1.64
1,29,"Unfortunately it would come from your paycheck, but Lowe's/home Depot sell white board material in huge sheets that you can cut down. I think a 6x8 sheet was like $20, so it would probably take 2 for a whole class",0,0,0,0,0,0
1,30,Sounds right 🙄,0,0,0,0,0,0
1,31,Sounds about right...,0,0,0,0,0,0
1,32,"watch every single 5 minute crafts video and make a DIWHY installment
idea:
hot glue everything not nailed down to the playground. staplers, desks, lamps  children, etc.",0,0,0,0,0,0
1,33,oh... glue STICKS... uhh... smell some markers for inspiration.  idk most abstract art needs a medium. how good are the kids with a tig\mig welder?,7.69,7.69,0,0,0,0
1,34,"I was once told I had to buy my own exercise books for my class because the school didn't have any money left in the supplies budget. Literally the next day I took my kids swimming, had a look in the swimming store and found four underwater scooters which were sitting in their boxes because none of the swimming staff knew how to use them and nobody had consulted them when ordering for the pool.
This was in a school in the richest country in the world and which had a full-time resources person whose job was ordering paper and dishing out pencils... sorry, I mean his job was drinking tea with the dude whose job was organising school trips (guess who got to take their kids to Pizza Express!?)....",0,0,0,0,0,0
1,35,"you shouldn't have to buy gluesticks
because you should be optional with an acceptably robust online offering available for those who can't, or don't want to, attend a physical location",0,0,0,0,0,0
1,36,"You can thank the rare district employees who exploited ""discretion"" to embezzle some money in the past for this crap.
You can also thank the well-intentioned idiots in state legislatures that, in an effort to prevent thousands of dollars worth of fraud, removed that discretion and end up causing millions in waste.",0,0,0,0,0,0
1,37,uh....we don’t even have glue sticks unless teachers buy them,0,0,0,0,0,0
2,39,"Honestly if I send out 30 emails and phone calls I get 3 parents that do something, 2 that email me back, 90% of the calls go to voicemail, 5% arnt valid numbers, and at least 10% of the parents have the school phone/email blocked.",0,0,0,0,0,0
2,40,"That sounds about right.  It is good to know that I am not alone.  I had a PD today where everyone was singing praises.  One who said she had 100% engagement in her online class.  I have one online class with 40 students; only 8 of them signed in.  What is she doing that I am not?  Everyone looks at these situations through rose-colored glasses.  What will happen when these kids hit 18 and cannot read, write, or even think on their own?  I am worried about the future of civilization.",2.2,1.1,1.1,1.1,0,0
2,41,That teacher who says she has 100% engagement is lying.,0,0,0,0,0,0
2,42,Or she has 100% engagement from the 8 or so kids that actually show up. Engagement is not the same as attendance.,0,0,0,0,0,0
2,43,"Yes. 'On task"" vs ""in task"". Not the same thing, although they sometimes appear to be the same.",0,0,0,0,0,0
2,44,"Yeah, I know.  We all know the ones who bullshit during PD's.  It is tiring hearing all the happy teachers then hearing them talk afterward.  Why don't they say what they mean, want, or need during the meetings?  I did today, and then I told them I needed a moment to collect myself.  When I came back to the team meeting, my principal was there.  He gave me a new perspective in some ways.  The thought is to focus on the kids who are engaged and who are trying.  Let the dominoes lie where they land for the others.",2.02,1.01,1.01,0,0,0
2,45,"That’s what I’ve been doing.  I tell my students that I’ll lead them to the lake, show them the water, but at the end of the day, it’s their responsibility to choose whether they drink it",0,0,0,0,0,0
2,46,No. Because then they want fucking grace for the “others”,0,0,0,0,0,0
2,47,Or oblivious.,0,0,0,0,0,0
2,48,I was going with delusional...,0,0,0,0,0,0
2,49,"I agree. Sometimes the ""perky positives"" choose to not see what is clear.  I had a perky positive SPED teacher who used to say all her kids were great. She was unable to spell herself, take the kids outside instead of teach. But all her kids were ""doing great"". It was always my boundaries and requirements that made them fail, not her airy fairy thinking.",0,0,0,0,0,0
2,50,"I hate it when people lie about that stuff. A group of 6 teachers will say, “Tyler is failing my class so spectacularly it’s almost impressive” or “If Madison could kill me with a sneer she would,” and invariably someone is like “Tyler has an A+ in my class and told me I’m the best teacher he’s ever had, and Madison asked me to make a toast at her Sweet Sixteen and sent me an Edible Arrangement that spelled out Amazing Teacher in pineapple slices.”",2.35,1.18,1.18,0,1.18,0
2,51,"Sure, all her kids log in to zoom.  
The cameras are off, but they logged in!",0,0,0,0,0,0
2,52,"Was this PD in the same district? I teach at a small private school and have 100% engagement with video on and participation from all students during a class. Is is possible that this person is just dealing with a VERY different group of students/families? 
I highly doubt it has much if anything to do with you. I am not the reason I have 100% engagement, it is my circumstances.",0,0,0,0,0,0
2,53,"I stalk my families. I email, call and text, every single time a kid does not show up. I cant force them to do the work, but they damn well arent going to be able to say I didnt do my due diligence to get their asses to the screen. I also document every time they dip out and I sick my admin on them. Ive got 100% bodies in front of computers, but about 20% of them dont do a damn thing and I document that as well.",1.12,0,1.12,0,0,0
2,54,How do you find the time?,0,0,0,0,0,0
2,55,"Most of the time during the asynchronous time and in the early morning,(Im usually up by 0500), and during the office hours. I dont do shit in the afternoons because I give myself back MY time. I remind students at then end of every day that I expect to see them bright and early the next morning so I dont have to call their parents. It helps that the parents are often sitting close by and they know I mean business. I only have 3 kids that are fuck off's, the majority are there and trying and I even have some who ask to stay on at the end of the day to chat, and they get upset when I dont give homework, so I am lucky this year.",0.77,0,0.77,0,0,0.77
2,56,Wow! That sounds like heaven.,20,0,0,0,0,0
2,57,What do you teach?,0,0,0,0,0,0
2,58,"I teach the little ones, (2nd grade at a Title 1), so its not really the kids that are the problem, its the adults, but our documentation and requirements for outreach are RIDICULOUS.",0,0,0,0,0,0
2,59,"I was mainly surprised because you only have 3 kids that aren't trying. I teach HS, just 3 would be a bloody miracle, lol.
I keep putting off making parent phone calls because it is such a huge endeavor.",2.56,0,0,0,0,0
2,60,"I dont do phone calls. I will text the hell out of them, email them and have their kid fetch them to the computer so I can have a Zoom chat with them, but I dont call. They wont pick up and can claim they never got it, but a text  with read receipts or sent from my Googlevoice account gives me documentation. Im also an ex-cop and dont do,""Nice"". I tell my kids that they need to work hard to be good at whatever they are going to do, and that being able to read and do math will give them tools to keep them from being taken advantage of in life. It works for the most part, and I work really hard to even educate the parents some. I would love to teach high school, but a brain injury took out all my higher level math, so my state wont let me teach HS ELA or Social Studies,(where the bulk of my degrees focused) so I teach future HS students.",1.72,1.72,0,0,0,0
2,61,"I mean...I have 100% engagement too, but I require them to be on Zoom to be counted as present.  I also am doing the awful blended model and refusing to do a separate class for online.",2.7,0,2.7,0,0,0
2,62,Are these effusive people also admins or in the administrative pocket? Admin big into making schools look good right now through disinformational bullshittery.,4.35,4.35,0,0,0,0
2,63,"I sent close to two dozen emails today to kids (seniors) saying ""you're failing, here's the assignments you can turn in so that you'll be passing"". 
I got one response; it was a kid I accidentally emailed who had a C-.",0,0,0,0,0,0
2,64,"How telling, wow! It makes total sense though",12.5,0,0,0,0,0
2,65,And maybe the kid shows up for 2 days right after,0,0,0,0,0,0
2,66,"Admins are weak and expect no responsibility from parents. If a parent demands X, admins wonder which is worse, the parent or dealing with you. Of course parents should do their part of parenting and teaching their child responsibility. Responsibility is a moral virtue and can be taught by anyone anywhere anytime, especially at home, it is not academic.",0,0,0,0,0,0
2,67,That’s why I push back against admin asking me to do unreasonable things. That’s why tenure is a thing (in my state at least) and why I’m grateful for it.,3.33,3.33,0,0,0,0
2,68,I’ve never understood this either. When I tell a parent their student is in danger of failing their response is usually something like “why didn’t you contact me sooner!?” Ummm. Because that’s not my job 🤷🏻‍♀️ it’s so easy to check your kid’s grades online I update them almost daily don’t blame me you were too lazy to check on your own. Also your kid’s about to be leaving the safety of high school and needs to take ownership and responsibility of his or her school work at some point.,0,0,0,0,0,0
2,69,"""why didn't you contact me sooner?""
My dream response:. ""why didn't you already know?""",0,0,0,0,0,0
2,70,Yes! Why didn’t YOU?!,0,0,0,0,0,0
2,71,"I update the electronic grade book regularly.
That is notifying them as far as I'm concerned.",6.25,0,0,0,0,0
2,72,Yesterday during a parent teacher conference this parent told another teacher in the meeting that it is part of our contract to contact parents when a students grade drops to a D or F. The parent was incredibly insistent on that and was just not wanting to hear what the teachers had to say.,0,0,0,0,0,0
2,73,I would like to know the answer to that one too.  It always is what are you going for the students who are not engaged that I should be doing.  Ummmmm I don’t know of any other profession that requires people to work after hours.  Excluding salary.  I work late into the evening sometimes until past 10 pm.  I get to school an hour early and it still is not enough.  Teaching on top of family issues.,2.6,2.6,0,0,0,0
2,74,I agree. I matter how many hours I work I feel like I am never caught up. People almost seem annoyed when I tell them I’m working at all hours of the day. They just don’t want to understand and accept that there is a lot that needs to get done and the schools hours do not allow for everyone be done all the time.,1.54,0,1.54,0,1.54,0
2,75,Agree!  There is never enough time.,0,0,0,0,0,0
2,76,"And yet, people still tell me that they want to go into teaching so they will be done at 2:30 pm every day, so they can have the same hours as their kids.  That one's always good for a laugh!",4.88,4.88,0,0,0,0
2,77,"Yeah my day starts at 6:30 ends normally at 8 pm, but sometimes at 10 pm. If I have a bad night my day starts at 4:30.  I am not sleeping because of all the stress of teaching online and in person.  😑",4.55,0,4.55,2.27,0,0
2,78,"Yep, I have those up at 4:30 days too! It sucks!",0,0,0,0,0,0
2,79,My father gets offended when I tell them I regularly put in 12 hour days. He has been convinced that teachers are this giant lazy union who never fire underperforming teachers.....,3.23,0,3.23,0,3.23,0
2,80,Please remember that when you assign homework.,0,0,0,0,0,0
2,81,"I don't assign homework.  Well technically.  The work we do in class is completed in class.  With remote learning, the assignments take them maybe 30 to 45 minutes.  They have two hours to complete it.  The reason the students are failings is due to not showing up virtually.  The district just told us that we have to post the assignment the day they are supposed to be online.  If they don't do it, we have to mark them absent.",0,0,0,0,0,0
2,82,"My administrator last year told us that we needed to call parents if the child's letter grade dropped between the progress reports which we do it about 4 weeks in and the nine weeks grade. A child who had an A on the progress report and then a B on the 9 weeks grade would need a phone call.  Incredibly ridiculous. Same situation, phone numbers don't work, or their voice mailbox is full or they don't have email. I called for my Google Voice number so sometimes I just get straight hang ups also.
My students are in high school. At some point they need to be accountable to themselves. Also if the parent really wanted to stay in touch with their kids grades, they would download the parent portal app and get notified when the kid has a bad grade. It's 2020. It's all online. I have a class website that shows people how to do these things.",0.63,0,0.63,0,0,0
2,83,I feel like that requirement is an antiquated carry over from before the days of parent portals. Is that requirement in your contract?,0,0,0,0,0,0
2,84,I can't find it in my contract.  I think it comes down to the teacher review at the end of the year.,0,0,0,0,0,0
2,85,"I'm sure they have 24/7 access to their grades through your district's grading program. Heck we even have an app and we are a small rural community of 12,000.",0,0,0,0,0,0
2,86,Yep. We have a grading program that updates grades live that parents can also create an account for.,0,0,0,0,0,0
2,87,"I sent out a dojo message, I’ve sent progress reports, and I sent emails.  I don’t have time to call 22 online kids while teaching 18 in person.  You have a computer and Internet to do online schooling, check your freaking emails.",0,0,0,0,0,0
3,89,"I can't get over how miserable students look during class time, and I see most of them just about every day each week. Back when I was first doing this, students warmed up to me after about a week or two. Nowadays, and I'm thinking of pre-Covid classes full of students, they just look so utterly miserable.
I'm not a young person, and I have a nephew who's about to turn 18. He's really the only young person who tells me stuff about his generation. I'd really hate to be a high school or college student these days. They seem to have it pretty rough with all the digital technology that constantly hounds them. And I get the sense that too many of them don't have real friends, and that's so different from when I grew up. Some of my childhood friends are still my closest friends, and we developed that closeness in sixth grade (now we're mid-50s).",1.9,0,1.9,0,0.63,0
3,90,"I'm 20 (in this group in the capacity of aspiring teacher) and I have to say I agree. With the onslaught of social media it's very easy to see all the world's ills playing out in front of you. As for connections, even before the pandemic people seem to mysteriously disappear whenever you suggest doing anything in person. It's all a bit bleak at the minute.",1.52,0,0,0,0,0
3,91,"Also in my early 20’s, also in this sub as an aspiring teacher. 
Yes, school absolutely sucks with us having to completely depend on technology/digital resources. School sucks for just about any grade level right now- I’m in college (supposed to start student teaching next year) and I feel like all my coursework has been watered down + there are days where my computer or wifi just completely freezes up and/or crashes in the middle of meetings or assignments. 
I feel socializing in general sucks too, since my generation has grown up with social media and become a little too comfortable with it. Trying to make and maintain genuine connections with others was pretty difficult before but the pandemic only made it worse.",0.81,0.81,0,0,0,0
3,92,Yes! There has been a marked shift since Covid. I can't help but worry about the long term effects of having spent the past 6+ months doing nothing but staring at their phones...,3.03,0,3.03,3.03,0,0
3,93,"My kids have been all about doing work on paper and then submitting a pic of it. They seem to be super over being on their iPads all the time, so hopefully they will be more open to human interaction whenever we get back",2.27,2.27,0,0,0,0
3,94,And we thought the addiction to devices was bad before...,10,0,10,0,0,0
3,95,"My #1 concern is that even when the pandemic ends face-to-face contact will be decent memory. Staring at our phones has been a way of life for what feels like so long now, I'm not sure how people would adapt to other alternatives.",0,0,0,0,0,0
3,96,Yeah I think having something in their hands by which to compare themselves to perfect people on the internet is pretty damaging for self esteem. I'm only 25 and it's been damaging for me.,0,0,0,0,0,0
3,97,"Exactly, I do worry about the long term mental health effects of this much screen time.",6.25,0,6.25,6.25,0,0
3,98,They are going through a legitimately traumatic time.  We all are. Some of us adults can barely hold ourselves together. I can only imagine what it’s like for them,3.45,0,3.45,0,0,0
3,99,"I understand that. So I don’t push it in person, I take the silence, I roll with whatever they are willing to give me, and I keep trying to lift their spirits if I can. It’s just so hard and defeating to feel like I’m giving my all just to get blank stares and silence in return.",0,0,0,0,0,0
3,100,"This. I know this is hard for them and we don’t know everything they’re dealing with and we need to give them grace. But damn, I need some grace too! I am also finding this extremely difficult if not soul crushing each day. I also have ADHD. I also hate staring at my laptop all day. I would never ask it like this, but I just wish the students could give me back some of what I’ve been putting in. It’s just hard to stay motivated when the most fun part of the job, actually connecting with and teaching kids, has been so scaled back.",1.9,0.95,0.95,0,0.95,0
3,101,"Yessssss. I’m such a social person, I love it more than I love teaching the content (which I love a lot so connections are everything to me). I wish I could just reach everyone but my arms aren’t long enough. Someone has to reach for me too.",6.38,6.38,0,0,0,0
3,102,"So well said. I really wish you the best. I hope we can all pull through this mess and get back to our classrooms (safely!) soon. Seriously, good luck and hang in there.",6.06,6.06,0,0,0,0
3,103,"Soul crushing is the exact way that I describe it, too. I could have written your original post. It’s roughhhhh.",0,0,0,0,0,0
3,104,"I was talking to my mom the other day about distance teaching, and I used the phrase ""soul crushing"". It IS. It's like we're doing all the WORST parts of teaching (managing kids, stupid busy work, meetings, dealing with difficult parents) and missing all the FUN parts of teaching (interacting with kids, watching them grow, spending time with colleagues, being queen of my beautiful and comfortable classroom). It's really hard.",2.86,2.86,0,0,0,0
3,105,Have a hug,0,0,0,0,0,0
3,106,"Yeah, That’s not new to virtual learning.",0,0,0,0,0,0
3,107,My district is on a hybrid schedule indefinitely so we’re face-to-face right now.,0,0,0,0,0,0
3,108,Mine too,0,0,0,0,0,0
3,109,"I teach college, but I have found the same thing. I honestly have just taken to stopping and taking about my own mental health and my struggles with the world now. I feel like it helps them, they seem to be better at interacting with each other and with me virtually now, but it can be hard to see the sadness and exhaustion. I've noticed a shift in how they see themselves over the last few years, they are very hard on themselves when they don't get something done right. They seem to have very high expectations for themselves and very little self-compassion for when things don't go perfectly. But perhaps they aren't so different from my generation, they are just more honest about their dark feelings??",1.57,0,1.57,0,0,0.79
3,110,"Agreed! I also teach college, and they are much more open to sharing their struggles, even in Zoom class meetings, than I think I would've been at their age. Opening up about how I'm doing is helpful because they see that it's okay to not be okay right now.
I'm curious -- are you a millennial? I am, and I think that allows me to understand Gen Z a bit better than if I were older.",0,0,0,0,0,0
3,111,"I'm actually a Gen X, right on the cusp of millennial though.",0,0,0,0,0,0
3,112,"I’m on the cusp with Gen X too, depending on the age range. Thanks for replying to let me know!",0,0,0,0,0,0
3,113,Nice! I read that they are trying to make a new category called Xennials that are a cross over of gen X and millennials.  🤣🤣,0,0,0,0,0,0
3,114,"I do the same, and it is tough to keep them motivated and engaged via Zoom when they're low energy. I've told them that none of us are the best versions of ourselves, and it's okay that we're all just trying our best to get through it. I don't know if they've accepted it though; I'm still working on it accepting it myself.",0,0,0,0,0,0
