post_id,comment_id,comment_body,emotion,emo_pos,emo_neg,emo_anx,emo_anger,emo_sad
40,1737,"They did that to us in spring and now are losing their minds when the state is now requiring attendance and kids aren’t showing up/failing due to not turning in anything because there was no penalty for not turning things in during spring. I teach an AP class and have never had so many parent complaints that my course is too much for their kids, despite me accepting all late work, spending one day a week on remediation/tutoring and lowering expectations all across the board. Some kids are just doing nothing and then are complaining to their parents that the workload is too high. I’m required to update grades weekly (2 grades a week) and parents can log in to see kids attendance/each assignment but it’s clear they never bothered to until I email them. This doesn’t even count the parents I can’t reach because they never bothered to update their contact info with the school. Parents btw are not asking me about the workload just demanding their kids be transferred out of AP, then getting angry when told that they can’t because the lower level classes are all full & due to Covid the counselors can’t jam 40 kids in a class anymore. (This has happened in every past year, to the point where teachers have to give up their desk to give kids a place to sit).",1.3,0,1.3,0,0.43,0
40,1738,“Advocate for themselves.” This is an extremely important skill and probably more important than the math you’re teaching them. It’s probably why we’re in this mess in the first place. To be honest too many adults just feel like the nanny state will do no wrong.,0,0,0,0,0,0
40,1739,"I teach 9th-11th graders, biology and chemistry, I literally have 13/110 passing right now because they simply aren’t turning in work. We use Canvas so I can see exactly how long they spend on things and most students are just completing the attendance requirement for the day like that’s all they need to pass...",0,0,0,0,0,0
40,1740,"Same situation. I give time in “class” to get it all done. Only about 30% take advantage of that and the rest are failing. 10th grade ESL, tho.",0,0,0,0,0,0
40,1741,"I'm a student-teacher working with a teacher in a culinary academy doing distance learning. It is already a challenge building lesson plans with students not able to use kitchens so we have them do busy work from the book and helping them get their food handlers card (which the school pays for). By this date they were supposed to have their food handlers card, working on chapter 7 of the book, and have a recipe book finished. Out of the 100+ students, only 20 turned in their recipe book, at least 10 students do not have their food handlers exam done, and 80% of the students have Ds and Fs because they don't do the chapter worksheets. Now she is getting parent complaints of why their child has a bad grade. I had watch while one parent drove to the school to yell at the teacher because their child has an F in the class. (Teacher and I work together in the classroom during class time while socially distancing and wearing masks.) If you don't do the work, you don't get the grade. It's heartbreaking to hear her explain over and over what they should have done or are doing and students don't answer.",1.47,0,1.47,0,0,0.49
40,1742,Been working as a tutor in affluent areas for about 13 years now. I can confirm that this is a biiiiiig mooooood. Dear god. The entitlement. It burns.,0,0,0,0,0,0
40,1743,"We had grades due Friday, then a week off. The messages that blew up my Schoology... 🤦‍♀️ I. Put. Video. Instructions. On. Every. Assignment. And asking me what you’re missing - every assignment is in Schoology! Look at your Schoology!",0,0,0,0,0,0
40,1744,Are we the same person? This is exactly my life teaching 9th,0,0,0,0,0,0
40,1745,"It's your fault. Everything is your fault. High taxes -- your fault, because you're a teacher, sucking on the public tit. And anything that you teach that's not sports isn't necessary. And kids suck at school because of you. Covid is your fault and all teachers' are responsible for it. Teachers are also responsible for the crappy economy and the mass layoffs. Teachers are the worst of the worst!
When are you going to figure it out?
/s",0,0,0,0,0,0
40,1746,"Saaaaaaame
Or they cheat by finding the curriculum key",0,0,0,0,0,0
40,1747,"OP, I teach middle school ELA and am having the exact same experience. Tell me why I taught the same curriculum, same school, basically same class schedule last year and had close to zero problems. Run it all back this year under distance learning and all of a sudden it’s too hard and they can’t learn. Failing about 60% of regular students. Failing very few advanced students but they’re getting some B’s and C’s, so I have to answer for why their perfect child isn’t getting an “A”. Also, you know what’s sick? When a parent of a pre-teen or teenager teaches their kid that their worth is connected to numbers and letters in a grade book. Instead of realizing that middle school grades do not matter in your life. Nobody cares what your middle school GPA is.",0.72,0,0.72,0,0,0
40,1748,"Definitely taking the ""closed mouths don't get fed"" line for sure. The problem is that admin will often blame you for someone not opening theirs.",0,0,0,0,0,0
40,1749,"I had a student say that to me. He was writing it for incoming 9th graders about my teaching style. He said if you have a question you have to ask, closed mouths don’t get fed. If you tell her you need help she’ll bend over backwards to help you. I’d stay at school with another teacher, that student and a few others till 10pm working on late work. 
Ever since he said that I’ve used it. It’s perfect.",0,0,0,0,0,0
40,1750,"For real though: “Am I missing any grades?”
“Have you checked Skyward?” 
“No.”
“So you want me to check your grades”
Student stares blankly",0,0,0,0,0,0
40,1751,Just wait till “hybrid”...this year is a joke.,0,0,0,0,0,0
40,1752,Thank you for this.,0,0,0,0,0,0
40,1753,I use Google hangouts text chat so that i can give tgem work to do RIGHT IN THE chat (individul chats). We have a group chat for class.,0,0,0,0,0,0
40,1754,"90% of the work we do in my class is graded for completion. 90% of it we do in class. If you are awake, paying attention, and TURN YOUR WORK IN, you will have an A. 
I have all As & Bs or all Ds and Fs. No middle ground. Either you're doing it or you aren't. 🤷🏻‍♀️",0,0,0,0,0,0
40,1755,Amen.,0,0,0,0,0,0
41,1757,"My jaw literally dropped.  
Your admin is a pos.",0,0,0,0,0,0
41,1758,"I had an admin refuse to allow my child to go to the elementary school next to my job.  I had gone UP the chain of command. Asking if it was possible to the secretary, teacher. Then principal.  
This ""admin"" was a curriculum coordinator.  How the hell was I to know she was in charge of outside admissions?  In the middle of a department meeting she shamed me, informing me that she had avoided my application.  I sobbed in front of everyone.  I exited and sobbed until I went home early.  I never trusted anyone after that.
My daughter was adopted from a war zone  and floundering in our local city school. Her behaviours were deteriorating.  I was going to pay my work place school 12k a year for her placement, as well as be able to look out for her and keep her with staff that were skilled and not burned out.  And kids who were out of control.  
I do not know WHY she did this. I thought we were on good terms.  I should have kept fighting. I thought going up the chain was better than approaching top people because inmost jobs that is the normal direction. 
My daughter continued to struggle in the city school. Beaten by gang kids, joined the wrong crowds and was skipping to have sex by middle school.  From then on, we had a downward spiral that I could not stop.  
I will never forgive that haughty bitch.  Your principal was wrong to do this.  I would leave an explanatory memo of what you did, why, what your principal did, and keep a copy in your file. 
When that bitch retired, we had a party.",1.41,0.35,1.06,0,0,0.71
41,1759,This story broke my heart. I’m so sorry that happened to you.,0,0,0,0,0,0
41,1760,I’m so sorry. I can ask how your daughter is doing now?,0,0,0,0,0,0
41,1761,"She is living on the streets and in shelters in NYC. She trusts no one.  We are raising one of her two children.  She is really incapable of working, she is off her meds.  I truly believe that had the bitch not done this childish power play ( apparently a typical Syracuse school admin behavior) my kid would be better off, taking her meds, and finished school.",0,0,0,0,0,0
41,1762,It’s crazy how we see a moment in a child’s life as the reason they are where they are. This Is meant as no disrespect to you. I’m sure as a parent you did all you could. My brother had an absolute shit teacher in 3rd grade and we believe that was when he shut down to school. He struggled his entire life and was actually anxious about sending his son to school because of one teacher. I work in that district and when I told him he immediately asked if I could find out if that teacher still worked there.,1.98,0,0.99,0.99,0,0
41,1763,"I literally thought I was stupid for 15 years because my 5th grade teacher sent to the hall everyday instead of teaching me math. I have struggled with math ever since, because one teacher decided not to teach me with my peers for 6 months - literally just put me in the hall with no work.",0,0,0,0,0,0
41,1764,"She had many issues. But this was the straw that broke the camel's back.  And the admin's attack was vicious, public, and came out of nowhere.",3.85,0,3.85,0,0,0
41,1765,That must be so painful. I hope one day she finds peace.,16.67,8.33,8.33,0,0,0
41,1766,"Does your state evaluation tool have a line about ""advocating for students?"" Probably in the professionalism section? 
Just send them a screenshot with the ""distinguished"" descriptor circled.",0,0,0,0,0,0
41,1767,Fantastic idea!,50,50,0,0,0,0
41,1768,My kind of hero right here.,0,0,0,0,0,0
41,1769,"I feel like admin need to practice exactly what they are asking me to do with my students. Understand the idea is not perfect and we are trying our best. Just like you should not send a negative email to a student you should not to an employee at this point. I lost my homeroom because admin said I was not making connections with the students. I am new to the school and my direction was to make them happy. We played games, shared stories and it was awesome BUT 6 boys literally never came to my class. I asked admin if I could send a message to parents they said no just mark them absent. 3 week later I get taken out of the position. I never met the kids and had no option. I invited them, personal emails, ect. But it's my fault I did not make a connection.",1.32,1.32,0,0,0,0
41,1770,"""Not perfect""?  theres nothing wrong w what i did.  The assistant super directed me to that person to order hot spots.  Never said go thru admin please.  One of the other people on that email, unbeknownst to my principal, also regularly advises teachers to email him directly. There is no requirement to go thru admin.  It's an imaginary standard.
In fact, they should be asking us to check specific things each week.  They should have a plan.  They should be communicating.  Instead ive got 30 fires to put out.  They should provide structure for their teachers.",0,0,0,0,0,0
41,1771,"Honestly the “go through admin” thing is just a power play. Cc’ing them on things that they might need to know about should be adequate. Otherwise, going to who you need directly to get things done should be fine. There are WAY too many middle managers in all areas of business and education and all they do is make everything nearly impossible to actually accomplish rather than the accountability they claim to be for.",0,0,0,0,0,0
41,1772,"I didn't interpret ""not perfect"" towards you, OP. I thought this comment meant that online schooling is ""not perfect"" and teachers are doing their best.",0,0,0,0,0,0
41,1773,I got called in to the office doe a talk because I cc’d someone on an email about online sexual harassment I was experiencing. They felt I was being disrespectful and signaling I didn’t trust them to handle the situation by including other people. I’m like...get off the table! This isn’t about you! This about me no longer being zoom bombed with sexual harassment! Grrrr,0,0,0,0,0,0
41,1774,"Same thing happened to me. They called all admin, dean, sped case manager, attendance guy in for a secret meeting to all ""norm"" on how to respond to me for my complaint against a student.  When everyone's reply was ""if that really happened, why would you want him in your class,"" i realized there had been a concerted effort to shut me down for speaking up.
I ask the case manager about it and she said it was a ""team decision."" Um, im on the fucking team. I went to the title 5 person to ask about it, and that guy told my admin! They said ""you dont trust us.""
Ugh, no. You implied i lied about sexual harassment and had secretive meeting wo me.",0.8,0,0.8,0,0,0
41,1775,"I’d reply all and let her know she’d let you know to try and resolve things before contacting admin, and this was helpful to students.  Could also say something about trying to take something easily fixable off her plate because you know she’s busy.  
Everyday I love my principal more.  She leaves us alone because she know we’re doing our jobs.",1.64,1.64,0,0,0,0
41,1776,"Yes i did. She replied all, ""admin first.""
Its actually laughable.",9.09,0,0,0,0,0
41,1777,"Wow, that’s insane. 
I’ve always felt like it’s too easy to become an administrator. Get a bullshit masters degree from online grad school, know the right people, and TADA you get to go on your little power trips. 
Good for you for doing the right thing for your students and for standing up for yourself. It’s like some admins and districts don’t also realize that now isn’t exactly the best time to micromanage and piss off your teachers. Good luck replacing me during a pandemic, idiot",5.81,2.33,2.33,0,2.33,0
41,1778,"I wish professional dev was required for admin. ""Reply all,"" ""Take everything personally,"" and ""demand a hierarchical structure"" fly in the face of everything out there she could read",0,0,0,0,0,0
41,1779,"Wouldn’t that create more work for the admin? Didn’t you actually do them a fucking favor?
Petty bitch. Lemme know when you’re ready to fight and I’ll back you up. I’m angry as shit, too, and I could throw some punches at some power-hungry mofos.",2.22,0,2.22,0,2.22,0
41,1780,"""Reply all"" dressing-downs are bullshit.
I got one a couple of years ago for asking if I could buy a bird feeder for outside my classroom window. I got a reply that went to the entire building admin team about how they attract pests and are ecologically dubious.
I was like, ""Bro, you could have just said, 'no.'"" 
Not sure why we had to get all the APs and supervisors involved.",0,0,0,0,0,0
41,1781,"reply all:
Dear Principal Fuckface:
Thank you for the feedback! Based on our discussion on (date), when you told me that because of increased workload for admin staff, that you would prefer I did more for my students directly before involving admin, I did not anticipate that my making this request directly to district would be an issue. Please advise if I misunderstood your directive, and if there is a district policy I violated, please point it out so I can review it and make sure I'm in compliance in the future. I am always ever so eager to be a good little doobie.  
Yours in solidarity,
OP",0.93,0.93,0,0,0,0
41,1782,chef's kiss,0,0,0,0,0,0
41,1783,"*Mr. Burns* Yesssss...
Follow her directive to a T. r/MaliciousCompliance",9.09,0,9.09,0,9.09,0
41,1784,You should reply all to admin saying what you said here,0,0,0,0,0,0
41,1785,"Oh, i did ;) and when she had the VP call me to ""see what i was thinking,"" i told him the same thing",4.17,4.17,0,0,0,0
41,1786,Good on you!  Stay strong,20,20,0,0,0,0
41,1787,Admin should have BCC if they don’t want Reply all.,0,0,0,0,0,0
41,1788,"Well, her initial email was a passive aggressive ""thank you"" to the gentleman at district, and then she added it should have gone thru admin first.  Only way for me to see it is to reply all lol.  And how would she ever thank him for his help without me seeing it?",3.85,0,3.85,0,3.85,0
41,1789,"Sorry, I misread/understood situation, it’s been a long day. She definitely should not have BCC or replied all, jerk move on her part. I guess BCC could save someone from this but thanks for looking out for the kiddos and let us know if they find that district policy.",0,0,0,0,0,0
41,1790,God I hate when they forget!  All admins must teach in the virtual/physical classrooms at least once a month!  That’s what I would require!  They loose all empathy!,6.9,0,3.45,0,3.45,0
41,1791,"I'm not sure if it's always been this way, but the gap between teachers and administrations seems to be widening every year.
Administrations can literally ruin an entire career or make someone not want to teach anymore, which is really sad. Some administrations I've worked for have been great, but all the ones that are deeply rooted in bullshit bureaucracy have been god awful. It's just one power tripping asshole after another.",2.78,0,2.78,0,0,1.39
41,1792,"Yeah, this site im at is super toxic. Our principal has non-reelected two probationary teachers (one of which was amazing!) due to excessive absences from chronic illness. Super harsh.
Imagine fighting chronic illness and pain, lesson planning for all your absences, taking a paycut bc u ran out of sick leave, and then getting non reelected to the entire district bc your principal would rather have a tenured jerk off who is getting kicked around from site to site in the district bc he sucks but, hey, he shows up every day.",5.43,1.09,2.17,0,0,0
41,1793,"That's the kind of crap I'm referring to right there. Just poor decision-making because of out-dated rules that have no place in education anymore. I'm truly sick of it. It's not you or me or other teachers that suffer the most, it's the children and that's what pisses me off. My biggest concern with current administrations is I honestly don't feel like most of them give two shits about the KIDS. Nope. They care about themselves, their pockets, and whoever else is going to help keep those pockets filled. It has turned into a political shit show...kind of like our current government.",4.85,0,4.85,0,2.91,0
41,1794,"For a couple of issues that were continuously ignored I’d look up the dept heads and find out their contact info. Example; head custodians, food services, maintenance. So if the heater was always broken and no one attended to issue (true story it would fluctuate between 50-60°) I’d find out building hvac dept head or whatever contact info. Let’s say his name was Walter smith. I’d email my admin and say “should I contact Walter smith?” Or something similar. That worked for a bit. Always worth a try. 
And whenever I know my admin is giving me shit I ask “where is that procedure written down” or “can I get that in writing so I don’t forget and have something to reference to avoid this in the future?” Guess how many times I’ve gotten it in writing? 0. But I want to protect myself and always leave a paper trail showing I asked for support. Same with evaluations. If anything ever gets marked low then I ask how to improve, suggestions, etc. It never hurts to cover your butt even if you know you’re in the right. Work with the system.",0.52,0,0.52,0,0,0
41,1795,I think everyone is under stress. I think ur principal sounds like they are overwhelmed too. If it’s the only time this happened. I’d ignore it.,7.69,0,7.69,7.69,0,0
41,1796,"Thats a good point. Unfortunately, this kind of passive aggressiveness is her natural state.  She is q very insecure administrator and perhaps feeling exposed rn. That said, i need to learn to ignore it, regardless.",11.43,2.86,8.57,2.86,5.71,0
41,1797,You probably just hit the nail on the head. She is being exposed. I think some of the bad apples won’t be able to survive this year.,3.7,0,3.7,0,0,0
41,1798,Sounds like a grevience to me.,0,0,0,0,0,0
41,1799,It def went in the google doc,0,0,0,0,0,0
41,1800,"Um, i just looked at your comment history. Thanks for your shit superintendent, hes causing a fucking wreck over here. Want him back?",0,0,0,0,0,0
41,1801,Did Michael Hansen get another Admin job? Lolololol I am sorry.,0,0,0,0,0,0
41,1802,Jorge aguilar. Thankfully our district is union strong,12.5,12.5,0,0,0,0
41,1803,He was one of Hansen's lackies. Packed his bags when the big man got the boot. A union is necessary when dealing with that type.,0,0,0,0,0,0
41,1804,"He left you guys when yall were setting to strike and came to us in the midst of setting to strike lol.  Hasnt gone well for him.  napolean syndrome mixed w machismo with a dash of diplomatic deflection!
His cfo forgot to enter federal sped funds so the dostrict launched a ""cut expenses or state takeover"" campaign until the union found their missing line item.  Oops.  We were 22 mil in the hole, we had a 2 mil surplus",0,0,0,0,0,0
41,1805,Oof.,0,0,0,0,0,0
42,1807,Aww I was hoping it was for good stuff. I had half a class stay late one day to finish watching the film I had playing. It was for a film analysis unit and we weren't watching the whole thing in class. They're just sitting their chatting and talking about the movie until it was over-an hour after the school day had ended.,3.17,3.17,0,0,0,0
42,1808,"Had a kid tell me last week they didn’t know they needed to hand in assignments. I shit you not.
Edit: student is a senior.",0,0,0,0,0,0
42,1809,"I've heard that one too. One of my grade 8's figured that since class was online, she didn't have to do any math assignments or anything else.",0,0,0,0,0,0
42,1810,30 minutes into class today a kid asked me what we were supposed to be doing. I checked his screen and he was staring at the assignment for today...,0,0,0,0,0,0
42,1811,"We were taking a test today (on Google Meet) and then I started to get emails saying Charlie had turned in his late assignment. I asked him how his test was going and he was like ""oh I didn't think we were doing anything in class today""",0,0,0,0,0,0
42,1812,"I had a student on camera the entire class sit there and not take the test. She heard the instructions and just didn't take it.
She won't ask for help. The most confusing thing to me is her dad teaches on the district (high school only district)! Like if you don't know what is happening ask your dad for help",1.67,0,1.67,0,0,0
42,1813,He could have ADD and not understand the assignment or the directions.,0,0,0,0,0,0
42,1814,"It’s my first year teaching. Took over for a teacher who quit. Been teaching about a month and a half...anyway...
I post the assignments (and the submission link) on the “posts” page of my Teams page. Then the assignment tab. And there’s the assignment folder. 
90% of students get it. But there’s that 5% who I have no idea what they’re even doing and haven’t turned anything in. Then there’s that 5% who simply do not care.",0,0,0,0,0,0
42,1815,Only 5% of yours don't care? Lucky.,0,0,0,0,0,0
42,1816,"I’m an English teacher. It may or may not be more than 5% but it’s an estimate. It’s that small minority who honestly makes it harder because no matter what I say, what I email, or what I try...they’re indifferent. But then cry when they see Z Z Z Z on their electronic grade book",3.57,0,1.79,0,0,1.79
42,1817,"I teach theatre. The number of kids who don't think my class matters (or simply don't care) is absolutely staggering. I'd say roughly 1/3 don't care one bit about their grade in my class, no matter what I try (like you said). 1/3 just don't want an F and will do makeup work at the last minute, and the other 1/3 put forth consistent effort.",0,0,0,0,0,0
42,1818,I’m a choir teacher. I hear you. <3,0,0,0,0,0,0
42,1819,"Yes I can't tell you how frustrating it is to routinely have kids withdrawn from my choir class by guidance for a study hall because they're failing everything else. Because it's ""just"" an elective. And now I'm down to 6 kids. And 2 of them don't care or show up.",2,0,2,0,2,0
42,1820,I’m so sorry. This is a crappy time and I can’t even imagine being told “it’s just an elective”,0,0,0,0,0,0
42,1821,"Ugh. That’s devastating, I’m so sorry",0,0,0,0,0,0
42,1822,Oh boy. I wonder how electives and extracurriculars are taught during the pandemic. Theatre is a hands-on course and I can imagine it’s tough for you :/,3.7,0,3.7,0,0,0
42,1823,"87% of my algebra 1 students would have failed this marking period if I did not massage the grades a bit (edited to laugh at myself for saying 'a bit'). If it was not my tenure year (after 13 years teaching) I would have left them as they were. I warned that I would not be nearly as generous now that we are into eh second marking period and should know what's expected, it is going to be a blood bath.",1.23,1.23,0,0,0,0
42,1824,"I am jealous.  about 20% of mine get it. The rest are so lost.  I have had other just quit school because they couldn't handle doing it online. :(  Not good, but they will have to try again next semester or next year.",9.3,4.65,4.65,0,2.33,2.33
