post_id,comment_id,comment_body,emotion,emo_pos,emo_neg,emo_anx,emo_anger,emo_sad
21,892,Ha. My dress to impress meter has gone way down this year. I literally just wear in my hiking clothes and boots. We just had our first big covid wave at school today. Sent home 7 teachers with a faculty of 30 and for some reason are still staying open the next two days.,0,0,0,0,0,0
21,893,I’m sure it’s so our super can say how long we were able to keep kids in school.  A teacher died a district over and they are only going to part time.,0,0,0,0,0,0
21,894,"Yeah, one teacher who tested positive today is in her 60s and obese, so I'm worried about her.",5.56,0,5.56,5.56,0,0
21,895,We’ve got a title person who was retired but came back last year.  She’s been out 3 weeks already.,0,0,0,0,0,0
21,896,"The whole charade played out by the people in admin is getting to be too much to handle. My district is planning to extend face-to-face learning and I know of four of my virtual students who are going to switch to face-to-face (I am completely virtual now except for our in-person faculty meetings and duties). If we have a certain number wanting to switch, they might require me to be a face-to-face teacher. Students who are in school have to be 3 ft apart in class with a mask. Lots of local people don't wear masks or take this seriously. Every time I've brought up a concern, I'm dismissed. We have already had positive cases at the school which the public only knew about because the local news reported on it. I'm in the US by the way.",0,0,0,0,0,0
21,897,"I started in august with 9 kids.  Very easy to distance.  But then online got “too hard” for those that chose it, so they just kept coming.  There’s maybe a foot and a half between my 20 kids.",0,0,0,0,0,0
21,898,"“Make sure you’re distancing your students”
There are 18 of them in my room. How do you suggest I do that?",0,0,0,0,0,0
21,899,"Exactly. And I’m in elementary, they can’t keep off each other if I paid them.",0,0,0,0,0,0
21,900,"Honestly, high school isn’t much better, but mostly they want to crowd around one phone.",0,0,0,0,0,0
21,901,"Oof. I’m sorry for you and your fellow teachers. 
I was starting to think you worked in my district until I saw Ohio. 
Where I am we have been hybrid since the third week in August. 
It blows. 
I myself had Covid, and we’ve had 8-10 teachers out per day for the last two months.",0,0,0,0,0,0
21,902,Yep. We’ve had 12-15 out every day.  Half my team will be out the rest of the week as they have spouses who tested positive.,0,0,0,0,0,0
21,903,"I’m full time in person, 25 kids. District said they’re looking at changing quarantine from 14 days to 7. Looking for new district. This is the only place I’ve taught my entire career, so disappointed.",2.86,0,2.86,0,0,2.86
21,904,That’s ridiculous.,0,0,0,0,0,0
21,905,Not even sure it’s legal. Sorry we are both going through this. Stay safe!!,0,0,0,0,0,0
21,906,Report it to the county health board/whoever is in charge of stuff.,0,0,0,0,0,0
21,907,"Sounds like my district! And we were told it takes too long to let 23 kids wash their hands in class, so we just get hand sanitizer. They also only sanitize our desk 3 days a week. Unfortunately, it’s the only district within daily driving distance.",0,0,0,0,0,0
21,908,That is insane and not ok. Have you had large outbreaks?,0,0,0,0,0,0
21,909,"Yep. We only have a handful of kids in each class but they're all the kids you wish would stay home! Anti-maskers, the families who are still going every and anywhere, the kids who are in 12 sports, etc.",0,0,0,0,0,0
21,910,"I'm struggling because had to send information for a police report this morning and deal with suicidal student in the evening, still covering with 4 people a department of 5 that really should have 6 or 7,  and all I do is blanking call people on the phone all day when I'm not teaching on the teams call…
Haven't even started prepping for tomorrow and of course we need to have randomass god knows why meetings because our kids aren't learning enough ??? based off previous years data before i started teaching ???",0,0,0,0,0,0
21,911,"yeah its ridiculous. In my district our threshold for going online  was 6 cases in the district (small rural) but they are still in session with 4 teachers out just at the elementary.  They told one of the teachers ( the football coach) NOT TO GET TESTED and come back ""when he felt better"" like what the absolute fuck? The worst part is there is no HR dept in my school so we have no one to air grievances with",0,0,0,0,0,0
21,912,"Make an entire hazmat suit out of jeans.
Yikes. Sorry you're going through this, OP.",0,0,0,0,0,0
21,913,I'm in the UK and your post relates so much to what schools are doing over here!,0,0,0,0,0,0
21,914,"We've been placated with more jeans days this year...it's so demeaning.  I'm not a teenager.  Your situation is definitely worse than mine, power to you.",0,0,0,0,0,0
21,915,"We’ve worked out that we have had 14 cases total, students & teachers (we are co-seated). The district is reporting that we have had 10 total. We have 18 students quarantined right now...they don’t care at all.",0,0,0,0,0,0
21,916,"Yeah same here.  I'm in Pa and we have been in person since August. I have both in person and online students but more and more students are moving to fully in person. I teach 8th grade so I teach multiple sections per day. I have 18 desks in my class in order to be ""socially distanced"" (which really means only 3 feet apart at best) and 7 lab tables. That's a total of 25 places for students to sit. I have a class with 26 in person students and 6 online. I have no place for these kids to sit. Every week we get multiple emails of kids having to quarantine and then emails about kids or people at whatever building that have tested positive. We are still in person and they're taking more and more kids every week in person. It's freaking crazy. But ""kids don't get it bad"" so fuck all the staff and their families though. It makes me so angry.",1.82,0,1.21,0,0.61,0
22,917,Wow! This is so informative and a big help for future stuff I’ll keep in mind. Thanks so much for sharing!!!!!,4.76,0,0,0,0,0
22,918,"Thanks for the source! When I am shared resources, it usually takes someones praise for me to believe or even remember it. Do you use any of these resources? Has anyone else enjoyed any of these resources?",2.7,2.7,0,0,0,0
22,919,"Personally, as an English teacher, I use the following the most from the list:
Hemingwayapp - AWESOME for my ELA students. Keeps them from going on long run-on sentences.
Kahoot! - Such an awesome way to quiz materials in an interactive and fun way. 80% of my kids this year, before even getting to know me, asked me if I would do Kahoot!. Super popular with the kids.
Poll Everywhere - An awesome visual way to do quick polls, word clouds, and surveys. The results update with visual charts in real-time, so it's super fun and interesting if you can incorporate it into a lesson.
NewsELA - Allows you to assign and read many, many, many various articles on ALL sorts of topics. Super relevant stuff and they crank the articles out every week. You can adjust the reading difficulty from 4th grade up to 12th grade... and the article will change its complexity! Really useful for scaffolding and introducing relevant topics.",3.16,3.16,0,0,0,0
22,920,"Those are all great. I also like ReadTheory. Free reading comprehension practice. 
My 5th graders and my 9th graders liked it.",0,0,0,0,0,0
22,921,"I love read works, especially their article a day. Easy fun bell work for my fourth graders.",11.76,11.76,0,0,0,0
22,922,"Try gimkit. You have to make the quizzes yourself but it's more competitive for the kids. They get really into it, lol.",0,0,0,0,0,0
22,923,"This is awesome! I’ve only looked through a bit of it so far and saved it to look at more closely later. I’m Canadian so the US-centric stuff isn’t super relevant, but it’s still an incredibly helpful resource. 
I hope you got a good grade for this!",6.25,6.25,0,0,0,0
22,924,"Thank you so much. I started doing something similar for myself, but you've done a much better job. You are the real hero.",0,0,0,0,0,0
22,925,"This is great, thank you for sharing!",0,0,0,0,0,0
22,926,You’re an absolute angel. Thank you!,0,0,0,0,0,0
22,927,Wow!!! Thank you so much!!!,20,0,0,0,0,0
22,928,"Amazing, thank you!",33.33,33.33,0,0,0,0
22,929,Thank you so very much!,0,0,0,0,0,0
22,931,Thank youuu soooo much!,0,0,0,0,0,0
22,932,"Thanks for this, I really appreciate the links and descriptions!",10,10,0,0,0,0
22,933,Thanks!,0,0,0,0,0,0
22,934,Thanks!,0,0,0,0,0,0
22,935,Thanks!,0,0,0,0,0,0
22,936,Thank you! I’ll share this with the teachers in my hall. Fabulous resource!!!,7.69,7.69,0,0,0,0
22,937,Thank you so much!!,0,0,0,0,0,0
22,938,f,0,0,0,0,0,0
22,939,Thank you so much for making my student teaching experience a little less daunting  💕,7.14,0,7.14,7.14,0,0
22,940,"Thanks for sharing this list! If you're into digital learning tools, you might find KardsAI useful for making and organizing flashcards. It's been really great for me.",0,0,0,0,0,0
22,941,https://learningcorner.co/tools/games,0,0,0,0,0,0
22,942,"I’ve been doing volunteer tutoring locally and have been using a webapp called Bookoora Learn. There’s a free version under trial. Basically, it supplements physical test papers, which saves me carrying heavy stacks of paper when I visit my students’ homes.",0,0,0,0,0,0
23,943,"Very helpful! I didn’t realize how different the viewing experience on Zoom can be for each student. That’s a very clear walkthrough for helping students learn the functionalities of Zoom, I’ll be using that for sure.",0,0,0,0,0,0
23,944,"Love the Snapchat video filter suggestion!!! Was thinking of occasionally dressing up in costume, but this would be much easier. We have dress up days, but pajamas aren’t as special when they’re learning from home.",2.86,2.86,0,0,0,0
23,945,I just installed that.  We have our first staff zoom meeting tomorrow.  Time for fun...,6.67,6.67,0,0,0,0
23,946,"I wasn’t able to, but am definitely bugging someone about that tomorrow",0,0,0,0,0,0
23,947,I would be really interested to know how you came to be an online teacher! I'm currently working on my degree and want to teach exclusively online but I can't ever find a lot of information on how to actually do it. Any advice would be appreciated!,2.13,2.13,0,0,0,0
23,948,"I sort of stumbled into the field and was very lucky to end up at a great school trying something unusual, so I'm not in a great position to give advice. That said, two things I'd recommend would be: 1) try to figure out ways to help out right now, since there are probably tons of teachers/schools in need of help, 2) take a variety of online courses that are done really well. Regarding 2, I was very fortunate to study educational technology online at Boise State in the middle of my teaching career, and that was an eye-opening experience, both in terms of the course content as well as the example of effective online instruction.",0,0,0,0,0,0
23,949,I would pay if you ever offered a zoom class to teach us a quick and dirty overview.  We had 3 days of PD but nothing that really helped me!!  I’m winging it by watching a ton of YouTube videos!,0,0,0,0,0,0
23,950,Thank you!,0,0,0,0,0,0
23,951,Thanks!,0,0,0,0,0,0
23,952,Thank you! I will be checking these articles out today!,0,0,0,0,0,0
23,953,This is fantastic. Thank you for sharing! Do you do PD in this for teaching staff?,6.25,6.25,0,0,0,0
23,954,"You're welcome! I don't do any actual PD; this was just ""for fun."" I switched jobs and now do something more run-of-the-mill.",4.55,4.55,0,0,0,0
23,955,"It’s brilliant. I’ve already made note of some things that will make zoom instruction way better and shared with my colleagues. If you ever would consider it, let me know! Thank you!!!",0,0,0,0,0,0
23,956,I’m so sorry pop out for I hope,12.5,12.5,0,0,0,0
23,957,These are so helpful! Thank you!,0,0,0,0,0,0
23,958,"This is amazing, thank you! Reimagining the chat and participant list; trying it today.",7.14,7.14,0,0,0,0
23,959,"Right on, please let me know how it goes!",0,0,0,0,0,0
23,960,It has helped! It’s funny seeing the kids in their little video boxes suddenly reengage (ex reenter the screen from wherever they were) when I ask for something in the chat or participant list,2.94,2.94,0,0,0,0
23,961,This is great. Thanks!,0,0,0,0,0,0
23,962,Thanks for sharing!,0,0,0,0,0,0
23,963,Very very helpful. I will be sharing this during our PD today!,0,0,0,0,0,0
23,964,Thanks for sharing - does google meet present the same challenges for online teaching as zoom does? So far not being allowed to use zoom has frustrated me - mostly bc of the lack of ability to push out small groups.,2.56,0,2.56,0,2.56,0
23,965,"I've only used Google Meet a bit, so I'd defer to your experience there, but my general sense is that it has the same fundamental problem of not being able to control what people see. Plus it sounds like it's missing breakout rooms, which is a bummer. The text chat is deprioritized in an annoying way, similar to in Zoom, though I believe there's one small perk which is that messages briefly show up as video overlays when you have text chat closed. So it would be harder for a teacher or student to be completely unaware of text chat. In general, I'd put it in the same category as Zoom--teleconferencing software that's ill-suited for the classroom, but not impossibly so.",0.82,0,0.82,0,0.82,0
23,966,"You put my fears into words! 😂 really appreciate your help though. Also, I teach kindergarteners so they can’t read text or to go into breakout rooms yet anyway so I was double wishful thinking there!",5.71,2.86,2.86,2.86,0,0
23,967,"! I tried to keep upbeat and open minded regarding how this might apply more broadly than my limited HS experience, but wow, kindergarten... I have so many questions and fears regarding how this is supposed to work. I'd love to learn more about what a successful online kindergarten class looks like. I guess part of why it's so hard for me to imagine is that I don't really have any sense of what regular in-person kindergarten is like.",6.41,3.85,1.28,1.28,0,0
23,968,"I just looked into creating breakout rooms, since we're not using Zoom either. The advantage of Google Meet is that the URL for a meeting can be reused. So if you create a shared Google doc of the main class meeting link, and below it have links to Breakout Room 1, Breakout Room 2, etc. then you can have student click the links and have their own meetings. You can have each breakout room in a separate tab (be sure you can mute tabs - use an extension if needed) so you can click among the rooms. 
I created a document that has unique links for each class and breakout rooms that I will just reuse throughout the year.
I also find it useful to have two computers logged into my main classroom meeting so I can see what the students are seeing. It helps me catch when I fail to change the focus while sharing my screen.",0,0,0,0,0,0
23,969,"Ah! You just explained to me the purpose of having a google meet nickname I think! In terms of why my admin wants us to create them anyway! Also, your idea for having both computers going is genius. THANK YOU!",0,0,0,0,0,0
23,970,"You can also reuse zoom links. Check your settings, the little gear icon",0,0,0,0,0,0
23,971,"Good to know for those who can use it. I don't know if Zoom's security changes have made them compliant with whatever protocols our school wants, but the district still hasn't approved it so I'm left with Meet.",2.63,2.63,0,0,0,0
23,972,Thank you!,0,0,0,0,0,0
23,973,Interesting. I will be revisiting your site after today's virtual PD.,0,0,0,0,0,0
23,974,"Omg thank you that's so useful! I'm having problems accesing to the website tho, I'll save it and try again later...",0,0,0,0,0,0
23,975,Pure awesome gold!,33.33,33.33,0,0,0,0
23,976,THANK YOU! Holy cow. I didn’t realize how much I needed this until I read every word of all three of your posts you linked. I (like my students) only really learned how to use the video/audio features of zoom in the spring. It left us all feeling disconnected and awkward most of the time. Now I feel like I have a handle on how to keep them engaged with the class during our zoom meetings. I seriously can’t thank you enough for sharing your wisdom and experience.,0,0,0,0,0,0
23,977,I'm so glad to hear you might find it helpful!,10,10,0,0,0,0
23,978,"Just out of curiosity, did these students chose this on-line option?
(And by extension so did their parents?)",0,0,0,0,0,0
23,979,"Yeah, we had a very high level of buy-in from students and parents, and there was no ""surprise now you're online."" This is one of the many asterisks attached to any claims I make about how well this can work, along with, for example, the fact that we set a hard low cutoff at 7th grade, but I'm still hopeful.",3.33,1.67,0,0,0,0
23,980,"And Zoom is absolutely not the best software for online classrooms. I don't know that there is a best software for online classrooms right now. I think the future of online classrooms looks a little like Twitch crossed with Discourse and Google Classroom myself. Twitch for the streaming, replay, and moderation, GC for keeping track of assignments, and Discourse for the portal aspect (each class is a server and can have multiple channels along with the voice/video chat capability).",0,0,0,0,0,0
23,981,"Interesting idea re: Twitch + GC + Discourse!
My two cents regarding the best software for online classrooms, at least the live online classroom aspect: Adobe Connect is hands-down the best, in a different league altogether. I am very disappointed that thus far Adobe has done nothing to help teachers besides a 90-day trial that expired in July.",1.79,0,1.79,0,0,1.79
23,982,"So my brief experience with Adobe Connect was pretty positive, my college used it for cohorts and seminars. It seemed to scale pretty well and it had a few features that suited a classroom better than Twitch. That might be a better starting point.",0,0,0,0,0,0
23,983,"Thank you for posting this, very helpful.",0,0,0,0,0,0
23,984,This is sooooooo helpful!  I will be sharing!!!,0,0,0,0,0,0
23,985,Thank you!!!,0,0,0,0,0,0
23,986,"This is absolutely amazing; I'm pissed I didn't find it sooner.  Thank you SO MUCH for doing this.  Question- do you have the screenshots you alluded to here?
Seriously- thank you so much.  This is so wonderful.",5.41,5.41,0,0,0,0
23,987,"Ah, sorry--as you saw, there are a couple screenshots in the article, but the others are theoretical. If you end up making them and putting them somewhere, please send me a link so others will have access.
Ideally, the whole thing would be a video of a smoothly running class, rather than a ""use your imagination"" description, so I hope someone makes that too!",1.54,1.54,0,0,0,0
23,988,"I did put it in a format here with some screenshots- I think this was the only part that I had trouble with:

Help the rest, and then walk through the process of getting out of fullscreen mode and finding the “Merge to Meeting Window” options within the text chat and participants list windows.

Just because I don't know how to do that (the merge to meeting window thing).
I wanted to add that I especially like how detailed you were with your reasoning- why it's important to explicitly teach all of these things.  Like most teachers, we started using Zoom with no info on how it actually worked, and I never once thought about these things (specifically the students' user experience) until I read your stuff, so thank you!",0,0,0,0,0,0
23,989,"Thank you so much for linking these. My district used Google Meet in the spring because our IT didn't have district-wide Zoom accounts with admin permissions, but now it looks like we're switching over the Zoom. In general, I prefer Zoom for a few reasons you've noted in the comments but I agree that both are not exactly designed with a classroom in mind. But regardless, your notes about building positive expectations and utilizing the chat and participants list throughout the lessons were really helpful for me. Thank you!",0,0,0,0,0,0
23,990,So glad to hear you found this helpful--I hope it works out well for you!,12.5,12.5,0,0,0,0
23,991,Saved. This is awesome!,25,25,0,0,0,0
24,993,This is one of the best analogies I’ve read! Thank you!,0,0,0,0,0,0
24,994,"""No, I will not add takis/hot cheetos to the menu.""",0,0,0,0,0,0
24,995,Omg yessssss ahaha,0,0,0,0,0,0
24,996,"Yes! I have been telling my students for years that I am like a restaurant. I plan the menu, prepare the food and decorate the dining room. They have to come in and pick up a fork and eat the food. Then I ask my 4th graders what the food is, and they all say, ""learning!""
Your comparison to this being a food truck where we are expected to provide an even wider array of options with less supplies, space, and support is spot on.  This chef feels exactly like you do.",0,0,0,0,0,0
24,997,"You forgot to mention the yelp reviewers. They aren’t chefs and have never run a restaurant once in their lives, but they won’t hesitate to tell you that you’re doing it wrong and will broadcast their opinions all over social media.",0,0,0,0,0,0
24,998,Omg yes. Except the yelp reviews are on the mommy groups on Facebook hahaha,7.14,7.14,0,0,0,0
24,999,YES!!! This comment is everything on top of an already fabulous analogy!!,8.33,8.33,0,0,0,0
24,1000,That's a fantastic analogy.  Spot on.,16.67,16.67,0,0,0,0
24,1001,What an amazing metaphor. Would you mind if I shared this with some of my colleagues? It’s just too perfect.,5,5,0,0,0,0
24,1002,Feel free:),33.33,33.33,0,0,0,0
24,1003,"Holy shit, that was amazing!",20,20,0,0,0,0
24,1004,<3,0,0,0,0,0,0
24,1005,"The only people who right now back online teaching are people who don't understand education because they don't care to really think about it or people with something to gain. Parents fucking hate it, kids hate it and don't really participate, and it's showing how important it is to have real contact with someone educating you.",3.57,0,3.57,0,3.57,0
24,1006,"If any good will come out of this, it’s a recognition that “online teaching” and attempts to replace teachers with AI does not work for K-12.
Its about being there together and creating an experience together every day. It’s about helping to make children into people.",0,0,0,0,0,0
24,1007,spot on!,0,0,0,0,0,0
24,1008,That’s the same analogy I made earlier today. It really is spot on though. It’s cooking but man you have to adapt.,0,0,0,0,0,0
24,1009,"Yes, chef!",0,0,0,0,0,0
24,1010,"I’m lucky because I don’t have my own kids to feed and nurture, on top of running the restaurant. I don’t know how those chefs do it. 

Those kids are all thinking ""I wish my parent wasn't a chef.""  <chuckle>",2.5,2.5,0,0,0,0
24,1011,Hahaha I love it,50,50,0,0,0,0
24,1013,Nailed it!,0,0,0,0,0,0
24,1014,Perfectly said,0,0,0,0,0,0
24,1015,A great analogy that is relatable in so many ways. Well done!,0,0,0,0,0,0
24,1016,Please. You don’t come into contact with 75% of your normal “restaurants” population. And they don’t dine in your food truck they dine at their parents house. I’m loving this break.,3.23,3.23,0,0,0,0
25,1019,"Here’s what I’ll recommend.
Look at one or two of the essays. If they are as bad as you imagine them to be, give the students a chance to self-assess their work, as it’s the first essay of the year. Give them a small assignment where they can criticize their own work and outline what they need help with. If they don’t complete the assignment, it’s a 0. Also stress to the kids that the prep work is a necessary component of writing, and must be completed. 
If you are really struggling, you can try to reach out to another teacher in your dept. and see if they can help you grade. (Don’t try this if you know everyone else is struggling as well). I have helped stressed colleagues do some grading in the past, and it can be a great temporary relief for them. 
Hopefully things can get better for you.",2.63,0.66,1.97,1.32,0,0
25,1020,Make a rubric for them to use to do the self-assessment. Have them submit the rubric as well. Spot check along the way. Grading done!,0,0,0,0,0,0
25,1021,Thank you. This is a great suggestion.,0,0,0,0,0,0
25,1022,"Use EduFlow's free peer review thinger, put in the basics of a rubric, and have them grade each other. It'll even make it so there isn't a name on the submission. Seriously, you'll get 3-5 ""grades"" per student paper, average it out, call it a day.",0,0,0,0,0,0
25,1023,Oh! It would probably be a good idea to tell them that that's how they're getting their grade after you try it out.,4.35,4.35,0,0,0,0
25,1024,"yesss, i always give several grades for each paper!",0,0,0,0,0,0
25,1025,Not a problem. Best of luck to you.,0,0,0,0,0,0
25,1026,"To piggy back on this - if you have a relationship with an aide at school, reach out and see if they can help. I’m a SPED aide (former SPED teacher), we’re all virtual, and I’m struggling to find ways to make myself helpful. With online learning I currently only work about 4 hours per day total so I’ve been reaching out to teachers and admin to ask for more work.",0,0,0,0,0,0
25,1027,"And tell them something like, if they didn't do the prep work but give themself an A on the self assessment you will drop them a letter grade from where their grade really should be. Just to scare them into honesty and make them think twice about skipping the prep work.",1.96,0,1.96,1.96,0,0
25,1028,"You could also swap with another teacher, do their grading they do yours.
I find it less heartbreaking to grade bad work from kids who aren't mine.",7.41,0,7.41,0,0,3.7
25,1029,This is great advice,0,0,0,0,0,0
