post_id,comment_id,comment_body,emotion,emo_pos,emo_neg,emo_anx,emo_anger,emo_sad
56,2460,"I found synchronous classes to be decently effective in the spring. Some regular schedule is really helpful! Here's what worked for me:
I started each class with norms, then a two-options check-in question that everyone unmuted and answered. (Students can respond to each other's answers in text chat only.) Then I gave announcements and showed my screen to give a brief overview on how to start the assignment. The rest of the period was dedicated to work! 
During work time, I had posted the assignment with ""make a copy for each student"" in Google Classroom, so I'd go and open each of their assignments, making a little comment out loud to the class for each one: ""Great answer, Charlotte!"" ""I see you haven't gotten started, Jimmy, can I help?""
I was also ready with another meeting link to have a ""breakout room"" if someone needed one-on-one or technical help, they could share their screen with me in there and get help. I'd just mute myself in the main class while helping one-on-one.",0,0,0,0,0,0
56,2461,I'm wondering if you can share with me what you mean by class norms.  Were these different each day?  Perhaps highlighting something that could be better based on the last class?  Asking because I'm just starting and this sounds interesting to me.  Examples could be helpful.,0,0,0,0,0,0
56,2462,"Not op, but to me class norms are the expectations of a zoom class: muted, raised hands, etc. Also the format of a class: starting off with essential question, read article together, class discussion, maybe breakout room discussion, exit ticket, with an extra assignment for asynchronous/homework.",0,0,0,0,0,0
56,2463,"Thank you for this.  I have started a ""Zoom Class Norms"" in my notebook.  This is helpful.",0,0,0,0,0,0
56,2464,"No problem. Highly recommend doing some youtube research, check out Ditch that Textbook, lots of resources out there. I’m entering my fifth year of teaching, but you’re not alone.",0,0,0,0,0,0
56,2465,"Class norms are super important for structure and predictability. This can be a bellringer (I give 5 review questions), a greeting to check how everyone is doing, or another consistent way to start the class. 
In f2f, I always began by asking the day of the week and date in Spanish (Spanish class), going over the agenda, and having the students write down their homework. 
Then, as they worked on their review questions, I went around and checked homework at their desks. 
Every. Class. Few. Exceptions. 
For virtual asynchronous learning, I recorded a video of me answering the previous day’s questions, sharing riddles students sent in, and being silly. Then, they would go to the same place to begin their assignment. 
Establishing these norms and not deviating too much, students became accustomed to the normal routine and made the entire class easier to handle.  
For synchronous learning, I would probably do something similar where I would share my screen with the date and agenda and start with review questions.",0,0,0,0,0,0
56,2466,"Oh, I love the recorded video of the answers.  I'm going to do this.  It will help if we all end up virtual and it will give me a few minutes for teacher-tasks while students watch it -- rather than me saying it 6 times a day.  THANK YOU THANK YOU.",2,2,0,0,0,0
56,2467,Excellent.  The tip about Few.Exceptions.  makes sense to me and I'm not sure I would have thought of it on my own -- with the thousand other things.  Some great ideas here and I appreciate it.,5.56,5.56,0,0,0,0
56,2468,Thank you!! This helps me a good bit.,12.5,12.5,0,0,0,0
56,2469,"Class norms are sort of the same as rules, so they don’t change each day but you may have some that are more important on some days than others. On example norms might be:
1) Turn off your microphone when you are not supposed to be speaking
2) Come “to class” wearing appropriate clothing and ready to learn
3) Stay on topic, do not post unnecessary links
4) Check for answers to your questions in three places (the assignment, the discussion board, and a friend) before asking",0,0,0,0,0,0
56,2470,Thank you!  Started my list for zoom.  This helps.  Three Places is great.  And it gives me a visible point in each day to state this.,0,0,0,0,0,0
56,2471,Thank you!!,0,0,0,0,0,0
56,2472,I have a simple Google Slide presentation that I am using. It shares the Zoom expectations and gives reasons why we have these expectations.,0,0,0,0,0,0
56,2473,"Yes I did this too! Check my post history in the ELA subreddit, got some great check list breakdowns is what to do in a zoom hour class.",0,0,0,0,0,0
56,2474,"Thank you for the advice! We did only asynchronous learning in the spring so this is a whole new thing for me. 
What types of norms did you have for online.",0,0,0,0,0,0
56,2475,"I actually found synchronous to work pretty well! I also teach middle school. I did a flipped classroom, so they watched their notes before class, and class was spent doing a zoom together to go over some examples and ask questions.",0,0,0,0,0,0
56,2476,"I agree that flipped is the way to go. We're starting off hybrid and expected to teach synchronously as much as possible (especially on our full eLearning day once a week), and I'm planning to flip at least two of my four preps.",0,0,0,0,0,0
56,2477,Yay! I’m super happy to see people who this worked well with. I am thinking about using the flipped model with everything so students have more flexibility.,7.41,7.41,0,0,0,0
56,2478,"It is a fair amount of work up front, but pays dividends on the back end. We start our synchronous time by going over what we did in the notes (I embed questions into the video) and so I am able to start each class with a formative assessment, which dictates where we go from there. It’s also super helpful for kids with Learning Differences who may need extra time, or may want to watch it more than once.",0,0,0,0,0,0
56,2479,How did you handle it when students came to class and hadn’t done the work?,0,0,0,0,0,0
56,2480,"Both my brother and sister (6th and 8th) have been in school for three weeks now. They start class at 8:30, five days a week. They are doing a lot better in the synchronous classes than the classes where teachers record videos of them teaching only. I think there is an important aspect of listening to teachers in real time and being able to engage in conversation with said teacher and classmates. 
That being said, it really is an equity issue. My mom is able to work from home so she is able to wake them up and make sure they are starting class. Those students who are left home alone (because their guardians have to leave for work early or they have guardians that just don’t care) don’t have that support to make sure they are logging on. It really worries me that this divide will have repercussions for years to come. I also really worry for the kids who are going back face to face. There’s already been a spike in covid in children and news that guidelines aren’t being followed by administration. This entire situation is a mess and we have nobody else to thank but Trump.",1,0,1,1,0,0
57,2481,"My mentor shared this idea with me in the mid-90s. It is an excellent idea. I have a 2'x2' box tucked in the closet of my office and full of notes, pictures, emails, cards, etc. given to me over the years. Rarely, do I go into the box; but, every few years I do and the feeling is lovely.",1.67,1.67,0,0,0,0
57,2482,"Definitely a must do idea! I am in my 30th year of teaching elementary school, and I have a massive file of student notes, drawings, and hand made cards. I also keep a separate file of positive notes, commendations, and compliments from administrators and fellow teachers. It can do wonders to look through these on a tough day. A really fun moment was when I finally became a ""grandma"" teacher. ""Ms. Midocean, you were my daddy's 4th grade teacher!"" It's a little bit of a shocker when that happens. But then I had the fun of showing this little student a hand made card her dad made for me years before. She giggled over dad's clunky printing and goofy picture. And dad was blown away that I still had it. Cool moment!",3.03,2.27,0,0,0,0
57,2483,"I am hoping to start teaching this fall, albeit a late start 13 years after I graduated.... but can I be you when I grow up? You sound awesome ❤",6.9,6.9,0,0,0,0
57,2484,You sound so nice 😭,0,0,0,0,0,0
57,2485,"The 10th grade English teachers at my school give a writing assignment at the end of the year where they have students write a letter to their favorite teacher.  They ask the community to donate picture frames so that students can give a framed copy of the letter to that teacher. Those letters are so precious to me!  I have a little gallery next to my desk that has sustained me through many a rough day.  The student council also hosts Teacher Oscar's in February.   The teachers are nominated for silly categories like the ""No Filter Award"" for a teacher who will say anything in class. The best part is the ceremony.  There's a red carpet and teachers enter the banquet through a crowd of students pretending to be paparazzi. Its so fun!  Things like that make my job wonderful.",1.43,1.43,0,0,0,0
57,2486,This idea was introduced to me years ago during my first year of teaching. She called it the “smile file”. I still have mine from years ago and add to it every year.,3.03,3.03,0,0,0,0
57,2487,"I call mine ""rainy days""!",0,0,0,0,0,0
57,2488,I call this the sunshine file,0,0,0,0,0,0
57,2489,"My name is Sunny, so mine is wrapped in wrapping paper and labeled “For Sunny’s Rainy Days.”",0,0,0,0,0,0
57,2490,Great idea! I've saved all that stuff but it isn't organized.,0,0,0,0,0,0
57,2491,Mine is just a cookie tin (which was a gift from a student) and it is a box of scraps. I kind of like the disorganization of it. I can just sift through it and feel better.,0,0,0,0,0,0
57,2492,"I created a “funny file” in my school email for things to brighten my day when I need a good pick me up. Ridiculous emails, pictures, screenshots, videos, etc.  Heavily recommend it.",6.25,6.25,0,0,0,0
57,2493,"I do this but with emails.  Most of my props were electronic at my old school.  I also kept the reference letters from the parents.  My email folder is labeled ""bad day cure"".",3.03,0,3.03,0,0,0
57,2494,I used this when I applied for and got a job a few years ago. Its a great tool for showing prospective employers how your students feel about you.,0,0,0,0,0,0
57,2495,"I love this idea! Not teaching yet, but I might start doing this now anyway",6.67,6.67,0,0,0,0
57,2496,I was cleaning through my classroom and found my box with drawings from students and it warmed my heart. I don’t know how people can just throw that stuff away.,0,0,0,0,0,0
57,2497,I don’t have a binder - I have a drawer. I call it my rainy day drawer. :),5.88,5.88,0,0,0,0
57,2498,I take pictures or screenshots of nice messages and notes and save them in a cloud file.,0,0,0,0,0,0
57,2499,"I subbed for this one teacher that had a lock box with a slit next to the turn in box. It was labeled “notes for me!” And I guess the primary use was for field trip forms and what not but she said she’d also receive pictures drawn by students, poems, and even occasionally letters on how the student is feeling.",0,0,0,0,0,0
57,2500,Great idea!,0,0,0,0,0,0
57,2501,"Yes! This is my ""happy folder"" for when things were tough and I needed a little pick-me-up. Best recommendation from my mentor teacher during student teaching :)",7.41,7.41,0,0,0,0
57,2502,I post the notes on my bulletin boards. Helps the kids remember that they were nice to me at one point in their lives.,0,0,0,0,0,0
57,2503,"I used to keep them in my closet at school, and hung a couple really good ones on the inside of the door. I also stocked it with chocolate and a couple stress balls/fidget toys for the really bad days :)",11.9,4.76,7.14,4.76,0,0
57,2504,"Man, I quit teaching in 2018 just in fucking time, I remember all of this mindfuckery you had to do just to not lose your mind.",0,0,0,0,0,0
57,2505,"Perhaps truthful, but is your comment helpful, inspiring, necessary or kind? No. 
Glad you’ve gone on to something new. Perhaps they have a subreddit you’d enjoy.",11.54,11.54,0,0,0,0
57,2506,I have a bulletin board above my desk specifically for notes and artwork from students,0,0,0,0,0,0
57,2507,"I did this at my secretary job w a terrible boss. I titled it ""Happy Thoughts"". Kept it up through 15 years of emotional abuse, so the happy thoughts entered were rare, but only the happy things are in there. 
I took it w me when I started teaching. I've it out an visible to my class. They're allowed to flip through it upon occasion. It helps them to remember that I'm a human w human feelings.",6.49,3.9,1.3,0,0,0
57,2509,I have this with notes from my wife and student art work.  Makes teaching easier knowing who I come home to and who I have helped.,0,0,0,0,0,0
58,2510,No dude. I’ve screamed I want to quit every damn day. Something has got to give.,0,0,0,0,0,0
58,2511,"Yes, I really don't know how much more I can take. :(",8.33,0,8.33,0,0,8.33
58,2512,"Meanwhile my non teacher friends don’t get why it’s twice the work. Well, I’m kind of writing a lesson plan that’s more in-depth then ever before* and then converting it to a PowerPoint that’s interactive for my online students.",0,0,0,0,0,0
58,2513,"Yes, exactly! And I still only get a short prep and a short lunch, so no time to finish anything",0,0,0,0,0,0
58,2515,"Yes, that's how I feel for my high school students, too. I really don't think they're getting the best version of my teaching self and I feel so bad about it. But I just can't do it all and I'm so tired already. But at least my students are old enough to figure it out and have a longer attention span (presumably). I can't imagine the online difficulties with elementary students.",2.82,0,2.82,0,0,0
58,2516,You could try writing your lesson plans directly in PowerPoint (or Google Slides) to save some time.,0,0,0,0,0,0
58,2517,"I would, but this new charter school has a very specific structure.",0,0,0,0,0,0
58,2518,"I feel for you all in Hybrid.
We're all virtual. I ALSO have come to the- I want to quit -everyday this week & it's only Tuesday. Everything's breaking I'm teaching all subjects to 4th & 5th graders. I just can't. I'm so tired.
EDIT: I just spent an hour looking for a DIBELS ORF to Lexile conversion chart & finally got my colleague to send it to me. I had originally found it myself in the first 5 minutes but rejected it because it only went up to 3rd grade. My colleague told me that we use the 3rd grade one.... I'm gonna lose my shit today. I just know it.",0.92,0,0.92,0,0,0
58,2519,"Yes, I’m on a hybrid schedule (today was day 9) and I am so stressed and exhausted I want to cry. It’s two full time jobs and is completely untenable. I also kind of hope that we’re forced into full distance learning because as much harder as it is than regular teaching, it’s still much easier than the hybrid model.",6.67,1.67,5,1.67,0,1.67
58,2520,"It really is two full time jobs! I agree, distance learning is still a lot of work but I'll take it any day over hybrid",0,0,0,0,0,0
58,2521,Is it not possible to prep one lesson and just film it for distance learner's?,0,0,0,0,0,0
58,2522,"Not with the school provided technology. I don’t have a mic or camera. My department also decided to work on essentials while students are in classrooms, so I do the same lesson two days in a row and they practice what they learned the next day at home. I teach HS English.",0,0,0,0,0,0
58,2523,What about your own technology?,0,0,0,0,0,0
58,2524,"Not sure why you're getting downvoted so much for that... You can record decent lessons with just a cellphone. A wired headset ($10? Or free with your phone?) will give you a better mic, and you can DIY a frame to hold you phone pointing down at your notes or onto a whiteboard and record a video.
Sure, it's not going to be the same quality as proper gear, but a modern cell phone is more than powerful enough to do this and literally everyone I know has one.
Edit: I used Lego/Duplo as a phone frame. Works great!",0,0,0,0,0,0
58,2525,"Teachers are often trained, particularly by unions, to abhor the suggestion that any personal equipment be used for anything educational.
On one hand, I get it. On the other hand, I hope that my attitude one day allows me to be a better teacher because I wasn't so obsessed with union loyalty.
I actually refuse to work in public education because of this kind of attitude.",3.03,1.52,1.52,0,1.52,0
58,2526,"I think it’s more that some districts stress that teachers are not allowed to or will be held liable if anything comes up. 
Honestly though, my own tech includes a phone and a laptop. How are either of those going to help teachers teach two sets of students at the same time? I’m picturing my laptop set up in the back of my room, live streaming while I am teaching, and all of the online students totally off task or being inappropriate while I can’t see the screen enough to monitor them. What are the logistics I’m not thinking of here?",0.99,0,0.99,0.99,0,0
58,2527,"Oh I agree, hybrid sounds like a nightmare
I'm glad I don't have to juggle it, it's honestly a stupid solution to a profound problem.",4,4,0,0,0,0
58,2528,"I assumed hybrid was asynchronous. You can't monitor a digital class and in-person class at the same time, but you can post a video of your lesson (fairly) easily.
Obviously still more work than in-person only, but recording a video on a cell phone isn't expensive technology. If you have a good Google Drive or O365 file-sharing system setup, it only takes a few minutes to rename the video file and start the upload (if you don't need to edit.)",1.25,1.25,0,0,0,0
58,2529,"Yes that makes sense. However, it would seem either necessary to edit or at least do something separate for sound quality. Teachers are teaching through a mask and recording their voices so they can upload for students? This also puts students at receiving the lessons later so obviously if they started at the same time something had to be created for the online kids. 
You also have to teach the online kids how to learn online which is not something you can do for the in person kids. It definitely is not as simple as recording yourself and uploading it. Unless you are doing that and it’s working well?",0,0,0,0,0,0
58,2530,We aren’t allowed to film our lessons if kids are in the room because of FERPA laws.,0,0,0,0,0,0
58,2531,"I'm on full distance learning, it's about the same amount of work as a normal school year, and is easier in some ways (though less effective, obviously)",0,0,0,0,0,0
58,2532,"COVID has revealed how flawed everything under the hood has been. It brought it to fruition and it's a bitter, soured taste (just came up with that; quote me in the future).
Education has always been shitty and it's getting shittier. Education as an institution is garbage now but it can be redeemed. COVID is just trying to get blood out of a stone in a tough situation and everyone everywhere is failing.
It breaks my heart to see what's happening to students in special education, especially those with severe/profound disabilities who've regressed. But the more I look at it the more I realize how it shows that society doesn't actually have any plans lined up for them anyway. If school going away takes away everything they've worked for then it's clear there's no actual independence being fostered. It's clear that after hitting 22 in my state it really is back to square one, and I hate to think that I was just teaching independent skills to kids so they can forget them before 23 if they don't get any sort of other placement or setting.
But that's not my fault. It's not anyone's fault. It's education's fault. It was likely always like this since we don't have any real social underpinnings that education serves; we serve education which is what marks the decline of any institution's moral core; when it's sold out.",0.43,0,0.43,0,0.43,0
58,2533,Wow. This is the best thing I’ve read in months. What do you teach?! And what an excellent point that really hits home how I’ve been feeling. We don’t have any real social underpinnings that education serves. It makes me feel like there is no point to anything I’m doing.,4,2,0,0,0,0
58,2534,"Hearing that is exactly my worst fears about hybrid teaching. I have been worried about hybrid burnout all summer, and so have been prepping my evaluator by mentioning the following whenever possible:
""I'm doing a flipped classroom model this year, with all lecture recorded. Whether we are in person, online, or hybrid, students will only be working in class. I will be monitoring and helping individual students from a safe distance. I have also cut group work so that we can continue socially distancing.""
Then I'm just planning to do one generic lesson for everyone and take a hit on my evals for the year.
Disclaimer: I understand many people have unreasonable admin or have a tenuous position and so cannot say stuff like this to principals, which sucks. I have worked with basically the same admin for 7 years with good rapport, which is why I am comfortable with this. I will probably get chewed out, but I know I won't get fired or non-renewed over it.",2.98,1.19,1.79,1.19,0,0
58,2535,"I really like the idea of the flipped classroom, but unfortunately, my team turned that idea down. I do think that will make it easier for you doing the hybrid! It will just be a lot of work to front load, but at least in-person classes are pretty simple.",0,0,0,0,0,0
58,2536,"That's a bummer that your team shot it down. Our school lets each teacher do their own thing. I think I'm the only one in my department doing flipped right now.
As far as the front loaded work - I figure at some point we'll be told we need to have recorded lessons anyway for students who miss synchronous virtual lessons, so I might as well start off that way. I think it's going to be a hella stressful year no matter what though.",1.2,0,1.2,1.2,0,0
58,2537,"Oh wow, I wish I could do that! I like all of my ideas more than the ones I'm forced to do haha. Yeah you're probably right about needing the recordings, and absolutely right about it going to be a stressful year no matter what. :(",8.7,2.17,4.35,2.17,0,2.17
58,2538,Can I ask how do you record your lessons? We are going in person (I am a long term sub) and at a loss right now. Do you record at home? And what device do you use to do it?,0,0,0,0,0,0
58,2539,"I record at home but I did spend some money.  I use my computer camera and teach to it.  I use an I-pad for close ups on demos and edit them in.  I use a program called Debut for screen capture,  that I really like, but screencastify , Loom  and screen castomatic have some free options that work.   I also edit my work with filmora.  Which I also bought.  and I got a video camera for my birthday this summer because my husband expected that I might need it... he wasn't wrong.",0,0,0,0,0,0
58,2540,"Thank you, I will look into it!",0,0,0,0,0,0
58,2541,"My lessons are on powerpoint and I record them at home using OBS (free broadcast software).
OBS lets me layer a video input (Canon EOS M50, but any webcam works) as a picture in picture in the bottom corner of a screen capture. So the students can see me and the powerpoint. You can also set up multiple scenes so you can switch to your camera being the main screen. I record directly to my hard drive, do small edits as necessary in Premiere Pro (any video editing software would work) and then upload them to our class google drive. 
Instead of a whiteboard in person I use a Wacom Intuos pen tablet to write directly on the powerpoint (also works with word).",0,0,0,0,0,0
58,2542,"I’m doing a flipped classroom too. We are still doing some science experiments in class (if I have enough supplies), having discussions and introducing new topics. But notes and vocab and review are all happening at home online. So my two sets of classes are a day off from each other, but I’m ok with that.",0,0,0,0,0,0
58,2543,"Yes, I really wish I could do that. :(",11.11,0,11.11,0,0,11.11
58,2544,"I wish you could too! It’s not easy, but it seems easier than the alternatives!",0,0,0,0,0,0
58,2545,Absolutely!,0,0,0,0,0,0
58,2546,Tbh it’s time to do the bare minimum and that’s that.,0,0,0,0,0,0
58,2547,That's what I began thinking today but even the bare minimum is so much,0,0,0,0,0,0
58,2548,"If you can—whatever you’re doing for online, make that your curriculum in the class or vice versa. Use the same projects, same lectures, etc. If it has to be less content than normal, so be it. You can get through this, but honestly, with the way admins are choosing to go about this, teachers should not have to pick up the slack and work double time without extra pay.",0,0,0,0,0,0
58,2549,"I agree and I really wish I could do that, but my district is still holding teachers to common district final exams, so I'm really afraid how bad my students will do and how bad I'll look if I teach less content. :(",9.3,0,9.3,2.33,0,2.33
58,2550,"well damn, I’m just sorry then. As bare minimum as you can get it while still maintaining testing curriculum. Just pisses me off to no end what is happening to teachers right now.",9.09,0,9.09,0,9.09,0
58,2551,Thank you for your kind words. It really is complete insanity and absolute carelessness for the health (both mental and physical) of teachers.,0,0,0,0,0,0
58,2552,"100% sensible, probably bohemian.",0,0,0,0,0,0
